Source,Compare,Value,Val Type 2,Val Type 3
desire power oppose enemy,since mind develop power extent give fear traditional enemy,0.814493598303149,0.8135816453173871,0.18181818181818185
desire power oppose suspicion,threat desire result,0.8191134332598501,0.8150870774132216,0.16666666666666666
desire power oppose suspicion,since mind develop power extent give fear traditional enemy,0.8000743132776437,0.8000995689360251,0.08333333333333333
desire power oppose danger life,threat desire result,0.8132717399165151,0.8093932034999989,0.14285714285714285
desire power oppose danger life,since mind develop power extent give fear traditional enemy,0.831482266688001,0.8315075343995627,0.07692307692307693
desire liberty oppose danger life,fire within without chance life liberty pursuit happiness,0.8378559076120836,0.7861127068853437,0.18181818181818185
family revolt threaten ignorance,reformer share preserve noble country dire calamity threaten,0.8099653972278044,0.8150927749580683,0.09090909090909093
desire fortune oppose danger life,fire within without chance life liberty pursuit happiness,0.8062928401194001,0.7632643845758078,0.08333333333333333
desire power oppose suspicion,threat desire result,0.8191134332598501,0.8150870774132216,0.16666666666666666
desire power oppose suspicion,since mind develop power extent give fear traditional enemy,0.8000743132776437,0.8000995689360251,0.08333333333333333
desire power oppose mental weakness,slowly physical power fail resolution grow strength diminish,0.8122574119253629,0.7690151218155775,0.08333333333333333
desire power oppose mental weakness,since mind develop power extent give fear traditional enemy,0.816969253373678,0.8169827817584364,0.07692307692307693
desire power oppose physical weakness,slowly physical power fail resolution grow strength diminish,0.8328925136017619,0.7761297877951588,0.18181818181818185
desire power oppose physical weakness,since mind develop power extent give fear traditional enemy,0.8240592959113634,0.8237267270366836,0.07692307692307693
desire power oppose lack influence,mercurial possess way mean beyond earthly power combat,0.8022812448710686,0.7622138582263096,0.08333333333333333
desire power oppose lack influence,since mind develop power extent give fear traditional enemy,0.8352372705349922,0.8281084804152898,0.07692307692307693
desire power oppose lack facility,mercurial possess way mean beyond earthly power combat,0.804155560535506,0.7732734297181115,0.08333333333333333
desire power oppose lack facility,oyd power much mind subtle force fully control perform,0.8014818013406831,0.7761349683504973,0.07692307692307693
desire power oppose lack facility,since mind develop power extent give fear traditional enemy,0.8240768193276686,0.8204532160978619,0.07692307692307693
relief stigma oppose mental weakness,remedy consider remedy useless infliction discomfort mental anguish,0.8066075113306888,0.8066656553404161,0.09090909090909093
desire power oppose lack information,since mind develop power extent give fear traditional enemy,0.8054971819017867,0.7942899328695057,0.07692307692307693
relief injury oppose mental weakness,remedy consider remedy useless infliction discomfort mental anguish,0.8374589331103459,0.8369320106005034,0.09090909090909093
desire position oppose lack influence,therefore subject influence,0.8045180961817321,0.7965097299107132,0.14285714285714285
desire information oppose danger life,threat desire result,0.8081484146663016,0.8107320133606005,0.14285714285714285
desire health oppose mental weakness,merely touch restore mortal health physical moral,0.8271432761745814,0.8277573127946232,0.09090909090909093
desire health oppose mental weakness,need need exercise physical mental,0.8174908963448986,0.8201189006675661,0.125
desire information oppose lack clue,appal information nevertheless prove merely fractional part truth,0.8013922325637489,0.808173596003999,0.08333333333333333
desire approbation oppose danger life,threat desire result,0.8139101788776921,0.8142488293454325,0.14285714285714285
relief sickness oppose mental weakness,remedy consider remedy useless infliction discomfort mental anguish,0.8184404011247477,0.8169222645811467,0.09090909090909093
desire health oppose physical weakness,merely touch restore mortal health physical moral,0.8599948191787267,0.8587699359661863,0.2
desire health oppose physical weakness,need need exercise physical mental,0.8088996618701583,0.8119715586073114,0.125
oblige prevent terrible injustice oppose danger life,must suffer consequence,0.8267483911601482,0.8228927153744016,0.0
desire accomplishment oppose danger life,life ruling race seem life enjoyment,0.8076177669873865,0.8019903597252658,0.1111111111111111
desire accomplishment oppose danger life,never age potentially capable utmost life,0.8009775804007121,0.8035351707221077,0.1
desire information oppose lack influence,therefore subject influence,0.8039294615160366,0.8233738174463621,0.14285714285714285
relief habit oppose mental weakness,remedy consider remedy useless infliction discomfort mental anguish,0.8052318445541192,0.8052744209656922,0.09090909090909093
desire home refuge oppose danger life,must sacrifice yima whatever leave country sacrifice yield life,0.8123161561997163,0.8089359165714276,0.07692307692307693
relief injury oppose physical weakness,remedy consider remedy useless infliction discomfort mental anguish,0.8136701577113887,0.8137522819631843,0.0
oblige prevent terrible injustice oppose suspicion,always suspicion upon cause bolster threat,0.8067413515270189,0.7891003578303853,0.09090909090909093
oblige prevent crime injury oppose danger life,must suffer consequence,0.8117899912430799,0.8136844462076509,0.0
relief injury oppose physical weakness,remedy consider remedy useless infliction discomfort mental anguish,0.8136701577113887,0.8137522819631843,0.0
desire vengeance cause loss valuable oppose physical weakness,threat desire result,0.8020753162809009,0.8047272768951759,0.1
desire vengeance cause loss valuable oppose mental weakness,threat desire result,0.8041486172468321,0.8061018067394851,0.1
desire vengeance cause injury oppose physical weakness,threat desire result,0.8062157236946719,0.8058591499589345,0.1111111111111111
desire vengeance cause loss valuable oppose false accusation,threat desire result,0.8070106871698727,0.8095812633446752,0.1
oblige prevent terrible injustice oppose physical weakness,must suffer consequence,0.8024919485878834,0.8018484758939137,0.0
oblige restore health happiness loved oppose mental weakness,merely touch restore mortal health physical moral,0.851878494003703,0.8493213429628141,0.15384615384615385
desire vengeance cause loss valuable oppose enemy,threat desire result,0.8001648904194095,0.8014106711640357,0.1111111111111111
desire vengeance cause injury oppose lack influence,threat desire result,0.8115221288142058,0.8141647763638516,0.1111111111111111
desire vengeance cause loss valuable oppose danger life,threat desire result,0.8205137581101972,0.8223224782061767,0.1
desire vengeance cause injury oppose suspicion,threat desire result,0.8246999260291948,0.8220245223181246,0.125
desire vengeance cause injury oppose lack facility,threat desire result,0.8106369332546474,0.8129350002564926,0.1111111111111111
desire vengeance insulter oppose danger life,threat desire result,0.8002988651180943,0.8004516080691043,0.125
oblige restore health happiness loved oppose lack information,merely touch restore mortal health physical moral,0.8020894602250719,0.7816040348704186,0.15384615384615385
desire vengeance cause injury oppose false accusation,threat desire result,0.8052451762179279,0.804057976216105,0.1111111111111111
desire vengeance cause loss valuable oppose suspicion,threat desire result,0.8234400160466706,0.8256556740003514,0.1111111111111111
desire vengeance cause injury oppose lack information,threat desire result,0.8262918262212321,0.8282150280945348,0.1111111111111111
desire vengeance cause injury oppose enemy,threat desire result,0.8094129479023423,0.8032895873049543,0.125
desire vengeance cause injury oppose danger life,threat desire result,0.8308446525187615,0.8279978738654131,0.1111111111111111
desire vengeance cause injury oppose danger life,must suffer consequence,0.8190620497043953,0.8155090831277604,0.0
relief imprisonment oppose mental weakness,remedy consider remedy useless infliction discomfort mental anguish,0.802829292773663,0.8029272765424529,0.09090909090909093
oblige restore health happiness loved oppose lack influence,merely touch restore mortal health physical moral,0.8229123458136954,0.8068344121526209,0.15384615384615385
oblige restore health happiness loved oppose physical weakness,merely touch restore mortal health physical moral,0.8794520848236583,0.8740212804768109,0.25
desire vengeance cause loss valuable oppose danger life,threat desire result,0.8205137581101972,0.8223224782061767,0.1
desire vengeance cause injury oppose mental weakness,remedy consider remedy useless infliction discomfort mental anguish,0.8043618927834817,0.8035209727266568,0.07692307692307693
desire vengeance cause injury oppose mental weakness,threat desire result,0.8079777802474309,0.8050816349890727,0.1111111111111111
lover falsely accuse commit crime,girl commit suicide,0.8080065711068914,0.7856505401121071,0.14285714285714285
misunderstanding cause accident,cause accident prevent inevitable result,0.8549464171434656,0.8547987191635252,0.3333333333333333
lover accuse deception identity,meddling betray identity,0.8218529767463933,0.8251730266007758,0.16666666666666666
beloved accuse deception identity,meddling betray identity,0.8463006359255512,0.8481646563429543,0.16666666666666666
remorse threaten result selfdestruction,threat desire result,0.8120474394749915,0.8106115382812241,0.16666666666666666
revenge seek immortal bring loss liberty,may death seek save treasure,0.8243867513766544,0.8067336985908097,0.1
revenge seek immortal bring loss happiness,may death seek save treasure,0.8031459368911197,0.7957385685012446,0.1
revenge seek immortal bring loss life,may death seek save treasure,0.8221592361914316,0.8138550976805549,0.1
innocent person accuse commit robbery,girl commit suicide,0.8196424087297581,0.8086851734873857,0.14285714285714285
innocent person accuse commit murder,girl commit suicide,0.8401795793599071,0.8274798747188755,0.14285714285714285
madness mental derangement threaten loss power,blight fall mental power nyllite dethrone,0.8397708542753183,0.8172084570066911,0.2
madness mental derangement threaten loss power,power mind suffer eclipse,0.8153532355538834,0.8157826601137863,0.1111111111111111
fortune threaten religious revolt,reformer share preserve noble country dire calamity threaten,0.8184536625771737,0.8238396532321293,0.09090909090909093
fortune threaten religious revolt,reformer share preserve noble country dire calamity threaten,0.8184536625771737,0.8238396532321293,0.09090909090909093
permit unrecognized brother commit suicide,girl commit suicide,0.8245905535609653,0.8156103363719575,0.3333333333333333
permit unrecognized daughter commit suicide,girl commit suicide,0.8411476898263721,0.8279881838637742,0.3333333333333333
permit unrecognized love commit suicide,girl commit suicide,0.8117785217504149,0.7990150451267556,0.3333333333333333
permit unrecognized mother commit suicide,girl commit suicide,0.8326949047297924,0.8295239484093768,0.3333333333333333
permit unrecognized sister commit suicide,girl commit suicide,0.8581720660454342,0.8499712689570247,0.3333333333333333
permit unrecognized father commit suicide,girl commit suicide,0.8134141592670076,0.8082629013824736,0.3333333333333333
appear plot ruin character character simply action put supreme test good,give perfect description character past well keep action story move,0.8098181899728283,0.8083752359919878,0.1111111111111111
wherein miscalculation date discover last minute save day,day perhaps forget possibility survive week,0.8281912643665891,0.8240339407952063,0.07692307692307693
wherein enemy attack mistake friend,cowardly pack charge upon defenseless woman dream alone object friend enemy attack,0.8125068496315803,0.7667667402688579,0.21428571428571427
wherein develop character story dual personality,story author first establish highly dramatic situation tell first five line character kill thereby also establish strong thread suspense create mind desire wherefore,0.8317431753113097,0.8397624161149218,0.08
indebtedness stand way,father stand way,0.8112648802533191,0.8515721195657436,0.5
probability identity question,certain question answer order identity may prove beyond peradventure,0.8264793338325606,0.8293999881483975,0.2
necessity determine good intention person,ex clusive aim please waffle thus always sure good term whatever may state feeling toward rest mankind,0.8033665930556477,0.7764854808677099,0.047619047619047616
rival exceed physical power,slowly physical power fail resolution grow strength diminish,0.8049817057716891,0.7108892006452275,0.2
rival exceed physical power,destroy gravity produce power equal force world,0.8083735643269779,0.7920747553707829,0.1
rival exceed physical power,mercurial possess way mean beyond earthly power combat,0.8105722687562112,0.7703164985218903,0.09090909090909093
physical welfare loved endanger,merely touch restore mortal health physical moral,0.8188265677098732,0.8003991231243192,0.1
need verify information,mean give information,0.8493425122464333,0.8569780656828833,0.2
need verify information,instance possible give information detriment prebble,0.8132351707557758,0.8306028104364176,0.125
handicap physical incapacity,need need exercise physical mental,0.8150619679698515,0.8180019768950527,0.16666666666666666
confront possible risk life,reason believe fight friend cover reckless disregard life consequence,0.8066237939871596,0.8080041917269539,0.08333333333333333
possibility deprive valuable property,wonder form property consider valuable mercurial,0.8213111526040541,0.8234308027145268,0.25
need verify truth important message,message usually quite important telegraph portant need concern,0.8306754548814244,0.8429369371077648,0.3
handicap mental problem,need need exercise physical mental,0.8019433072801561,0.8051460672777901,0.16666666666666666
necessity find clue,reason find search,0.8364860429050422,0.8341145498124436,0.2
necessity discover method operation mechanical device,primitive method transportation,0.8120934780602527,0.8139536023580116,0.125
epidemic break aboard ship,danger nearly prebble soon aboard ship flag,0.8092508547485644,0.8350055844242257,0.2222222222222222
masquerade aboard river boat,sneeze landing sneeze boat sneeze river,0.8056602650016479,0.8205367814214347,0.3333333333333333
invasion aboard ship,danger nearly prebble soon aboard ship flag,0.831586866161588,0.8184330410765902,0.25
attack mythical kingdom,ruler capture kingdom,0.8021058769647519,0.8018866755958378,0.2
attack aboard ship,danger nearly prebble soon aboard ship flag,0.8479079695501509,0.8584863716440934,0.25
carousal place aboard river boat,sneeze landing sneeze boat sneeze river,0.8370510187855842,0.8676450249315036,0.2857142857142857
riot aboard ship,danger nearly prebble soon aboard ship flag,0.8573579993728848,0.8674220730607974,0.25
carousal place bandit camp,find chinaman camp waterhole town,0.8150844585490038,0.8212299118332546,0.125
fire aboard ship,danger nearly prebble soon aboard ship flag,0.8029444631825423,0.8343804938709302,0.25
collision river boat,sneeze landing sneeze boat sneeze river,0.855269382192442,0.8863983177143044,0.4
race track scene breakdown,stubb race scene,0.8039211832677168,0.8047400548779283,0.4
fight aboard ship,danger nearly prebble soon aboard ship flag,0.8163853690141208,0.8379290736174825,0.25
attack forest,tree attack force grove,0.803854455422383,0.8295371043820817,0.2
attack mining town,work mariquita mine concern attack town canal,0.8017974259433622,0.7964682769704273,0.25
escape prisoner,ipse dixit escape,0.840312515571554,0.8473717015089964,0.25
give false clue information employee,mean give information,0.8053319221562206,0.8149459552651993,0.3333333333333333
learn friend loved consort enemy,friend enemy guess,0.8114908669798678,0.7957760696990317,0.3333333333333333
give false clue information employer,mean give information,0.8029302792887609,0.8124762900927794,0.3333333333333333
escape hostage,ipse dixit escape,0.8329037593317149,0.8256504857803495,0.25
become necessary rescue live sacrifice god,must sacrifice yima whatever leave country sacrifice yield life,0.8175763589888128,0.8062846410833574,0.07692307692307693
loss reward promise result dare effort,result dare hope,0.8106763349374643,0.810802625672462,0.2857142857142857
erroneous judgment threaten loss life,must suffer consequence,0.8089960672162534,0.8114493212201196,0.0
loss citizenship impend result fatal indiscretion,must suffer consequence,0.8025694817286999,0.805694486069126,0.0
loss citizenship impend result fatal indiscretion,cause accident prevent inevitable result,0.8102822838273824,0.8086754830570104,0.1
loss life impend result fatal indiscretion,must suffer consequence,0.8334543051056105,0.8348496430492558,0.0
loss life impend result fatal indiscretion,cause accident prevent inevitable result,0.8076781099631483,0.807750998649548,0.1
madness impend result unfortunate,impending doom strange may seem quieting effect upon nerve,0.8076078611717126,0.7549823133337218,0.0
loss reputation promise result dare effort,result dare hope,0.8084050971022056,0.8064638666597983,0.2857142857142857
fatal ambition promise cause loss life,must suffer consequence,0.8059268059799183,0.8080038257903407,0.0
loss sanity impend result fatal indiscretion,must suffer consequence,0.8131005898853769,0.8130186116436656,0.0
loss life promise result dare effort,possibly life hope mean attempt,0.8310145201531149,0.8321467365676792,0.1
loss life promise result dare effort,result dare hope,0.8167961277107489,0.8173109613070693,0.2857142857142857
loss liberty promise result dare effort,result dare hope,0.8055349403154265,0.8042034607201888,0.2857142857142857
loss citizenship promise result dare effort,result dare hope,0.8047060458662083,0.8042704098000114,0.2857142857142857
erroneous judgment threaten cause abduction,always suspicion upon cause bolster threat,0.8038717983538393,0.7632745175758497,0.1
loss protection law impend result fatal indiscretion,must suffer consequence,0.8020842564598021,0.8041624885688257,0.0
loss protection law impend result fatal indiscretion,cause accident prevent inevitable result,0.8127074052861925,0.8125625127003596,0.09090909090909093
loss sanity promise result dare effort,result dare hope,0.8278867671838057,0.8283772170960024,0.2857142857142857
loss loved impend result fatal indiscretion,must suffer consequence,0.8119863703872467,0.8149423263066908,0.0
loss loved promise result dare effort,result dare hope,0.8174339534303278,0.8167472309496169,0.2857142857142857
fatal ambition promise cause loss sanity,must suffer consequence,0.8092830872564849,0.8099049230025095,0.0
loss victory promise result dare effort,result dare hope,0.8042412311559974,0.8047003766149268,0.2857142857142857
personal combat knife sword,sword spear useless,0.8271928916999461,0.8202939553838148,0.16666666666666666
exhaust enemys food supply,probably eat food supply entire district,0.8008915034326487,0.7888532820585407,0.25
prevent torture accident,cause accident prevent inevitable result,0.8052447339155263,0.8008281221106036,0.3333333333333333
food supply intercept,probably eat food supply entire district,0.8038592626601129,0.8029583892315648,0.2857142857142857
storm wind,follow morning storm blow wind die skipper breeze heavy sea slowly subside,0.8342246919859712,0.8651892916043062,0.16666666666666666
runway street car,utter comment whipple cross street car track drive garage,0.8191437218407941,0.8507137498187818,0.2
particular conflict sex matter principle,love war however mean suppose fair endeavor apply principle present case,0.8085332354707879,0.8273295070475265,0.06666666666666668
carousal aboard ship,behind ship ship crew,0.8108452820612814,0.8166438060176037,0.2
carousal aboard ship,danger nearly prebble soon aboard ship flag,0.8505412812659585,0.8616422034074614,0.25
spectacular warning give lumberman,warning give good,0.8059368654949871,0.8029415937599066,0.4
spectacular break machinery implement build construction,muglug work build muglug,0.8004168301641534,0.7659841024173522,0.125
carousal enemy,deserter enemy grievance,0.813297859692518,0.7990667475721328,0.25
lose heart b woman wish marry,timon athen yearn desert place forget ingratitude believe friend kill thought girl ethel marry well,0.8005882173358523,0.8002279385498551,0.05
b desire love never lover feel keenly,sali never feel humiliate life,0.8012252978074539,0.7911606415138751,0.2
present sweetheart b novel story unknown contain character describe adventuress term exactly fit b novel mistake wrap send b gift former sweetheart name fly leaf various love passage mark something leave chance page book b offense incident story approximate event affair b slight reference b,eight paragraph later describe less hundred word event lead crisis open story present entire background complication give history character,0.8025929545944364,0.8042390495919651,0.09803921568627452
love b pretend deceased friend betroth b b family hearing death last believe spectre,ever since father death quarrel,0.8100862753225119,0.8061150386106959,0.0625
b love discover secretly longer love although willing marry promise,certainly love defer father whatever mine day,0.8022739213262667,0.8156384950771279,0.06666666666666668
b love certain reason propose love b,love war however mean suppose fair endeavor apply principle present case,0.8008600426449579,0.8250135180146395,0.06666666666666668
enterprise altruism find hard nature undergo beneficial change,skill show art apply highly develop mental process natural concomitant civilization mark every turn way mean oftentime inexplicable write experience painstaking care reader abide end shall instruct thrill convince well wa first shock,0.8120459068428053,0.8159331689805894,0.0
spite fact reason marry nevertheless plan,merely wish point even must admit fact,0.8000193691718104,0.7774483785846928,0.08333333333333333
overwhelm love commit suicide,girl commit suicide,0.8129234403197845,0.8075525621715084,0.4
desire poor marry b order may spend money,life shall pay poor enough forfeit,0.8118716270047813,0.8048439590301577,0.07692307692307693
desire poor marry b order may spend money,lavish money buy happiness canot happy way spend spend jt wish save save use ahead,0.8167212824480535,0.804799810356255,0.10526315789473684
call friend,bluff friend old partner call bluff,0.8166511030060768,0.8115799040647876,0.4
b cost life heroically save destruction life work husband,save life save,0.8390316539349484,0.8259545260298169,0.25
die result conspiracy b b suffer remorse,must suffer consequence,0.8103100453533657,0.8130063872272631,0.125
seek secretly preserve another danger,may death seek save treasure,0.8125740661888725,0.8121287056614982,0.1111111111111111
b wife leave city search country ideal life,leave country shall happy woman world,0.8046943115168724,0.8016678787948871,0.16666666666666666
lose job,lose job donot,0.8637889027267881,0.8648967547867243,0.6666666666666666
consider transgressor discover suppose transgression never commit,since mentally unsound crime attach act shall tell truth declare,0.8004669082107614,0.8126839076028568,0.0
seek secretly preserve another danger,may death seek save treasure,0.8125740661888725,0.8121287056614982,0.1111111111111111
mysterious absence many year return old home town,return home friend four long give dead cause sensation throughout country,0.8150001243219918,0.7766699672501759,0.1176470588235294
youth shelter world pamper dote parent true conception life ability face rugged issue,callow beginning old old tale part substantial child bubble yet occasionally woman ideal strike color moment ideal life,0.8102593857854362,0.7976083890622307,0.03571428571428571
youth shelter world pamper dote parent true conception life ability face rugged issue,child honest parent world mar life abandon tender year evil surrounding grow credit bear right teaching sift environment discrimination care,0.8237440741558197,0.8217966832377359,0.1
recover steal object x way return owner,recover steal property return rightful owner meritorious act,0.8257527325504932,0.7925167653220351,0.3636363636363637
way return owner steal object x recover lose object seek recover,recover steal property return rightful owner meritorious act,0.8194786746867241,0.7851406056908884,0.3076923076923077
writer unconsciously plagiarize work another author produce literary masterpiece,importance literary style clever literary style employ writing great many shortshort story accept publish qualify ordinary shortstorie,0.8161127648468346,0.8555803290809563,0.043478260869565216
told month live discover doctor error still long life ahead,may live week doctor may drag miserable existence year end sure,0.8536405517168569,0.8512241362935796,0.1111111111111111
told month live discover doctor error still long life ahead,day perhaps forget possibility survive week,0.8107636184515159,0.7940501494818681,0.0
told month live discover doctor error still long life ahead,soon find thirty year live instead six month course deal,0.8025583597473083,0.7902900007824655,0.1111111111111111
seeking finance gamble money lose,risk good deal money money afford lose,0.8285248441801117,0.8377546163849027,0.2222222222222222
